rid,question_name
5566,自 4 月 26 日起北京市对东城、西城、海淀等 11 区进行三轮核酸检测，还有哪些信息值得关注？
5567,北京医院通报「网传一孕妇在医院门口分娩」，称内容虚假，已报警，造谣者将承担哪些法律责任？
5568,5 月 19 日北京新增 50 例本土确诊，12 例本土无症状感染者，目前疫情情况如何？
5569,5 月 27 日北京新增 18 例本土确诊、6 例无症状感染者，目前疫情情况如何？
5570,北京朝阳区就核酸检测点调整不高效致歉，将加快核酸点由小区向社会面转移速度，具体情况如何？
5571,北京多区发布通知，无社会面活动人员不外出可不必每日核酸检测，哪些信息值得关注？
5572,6 月 13 日 0 时至 15 时北京新增本土新冠病毒感染者 45 例，目前当地疫情情况如何？
5573,北京健康宝升级市民出行受影响，健康宝设过渡期已有市民由 4 天变回 3 天，还有哪些政策变化值得关注？
5574,2 月 11 日，你遇到北京人最多的地方是哪儿？
5575,夏秋航季开启，北京新增多条航线，有哪些需要游客了解的？
5576,辽宁锦州继续坚守实现「动态清零」 ，官方发布称「放弃努力太可惜」，如何看待此事件？
5577,中疾控称 130 多个奥密克戎亚分支输入我国，含BQ.1和XBB，其传播优势会增加，哪些信息值得关注？
5578,干部强制要求便利店关门，被要求看文件后撂狠话「你等着」，如何看待此事件？具体情况如何？
5579,以前老外说“戴口罩没用”，我觉得挺反智的，从全国各地传染速度来看，问题出在哪儿呢？
5580,8 月 29 日石家庄新划定 31 个高风险区，目前风险区居民生活情况如何？
5581,上海交通大学 3 月 12 日新增 1 例确诊，部分宿舍楼封闭管理，现在情况如何？有遇到什么问题吗？
5582,可否让想清零的人自己在家隔离，让不指望清零的人回归正常社会秩序？
5583,郑州市将于 5 月 4 日 0 时启动 5 大措施，对疫情防控有哪些积极作用？
5584,今年的春节还能恢复如初吗？
5585,疫情放开以后，作为普通人，我们应该怎么保护自己？
5586,3 月 9 日兰州新增 10 例本土确诊，目前当地疫情情况如何？
5587,如何看待美方命令驻沪总领馆人员「强制撤离」，外交部回应「已提出严正交涉」？其中透露出哪些信息？
5588,多位专家表示总躲着新冠不是办法，称「阳性成常态，降级管理更合理」，哪些信息值得关注？
5589,一黄码男子 25 天没做核酸被罚 200 元，起到了哪些警示作用？
5590,警方回应「广州 2 名女子手被反绑跪地」事件，称「正在处理」，还有哪些信息值得关注？
5591,石家庄某医院回应取消免费核酸检测，目前医院只能做单人单采，价格为 16 元，透露了哪些信息？
5592,如何看待国家卫健委称有地方认为奥密克戎是「大号流感」，出现了「歇歇脚、缓一缓」的心态？
5593,当地回应重庆一副区长粗暴劝返外地车辆「离开，否则公安马上来拘留你们」，如何评价此事件？
5594,张文宏表示「感染峰值会很高，但趋于可控，疫情正过渡为季节性、地方性流行」，哪些信息值得关注？
5595,北京一男子得知自己密接后独守车内，小区 14 小时后即解封，这样的行为是否应该提倡？
5596,上海市继续优化调整疫情防控措施，对 7 天内无核酸检测记录的不再赋黄码，哪些信息值得关注？
5597,新十条发布后，养老院院长自述「抢不到抗原药品、拨不通急救电话、缺乏医疗应急预案」，为何会出现此类现象？
5598,借口买菜实则参加岳父葬礼，江西警方连夜擒获 4 名涉案人员，如何从法律角度解读？
5599,3 月 11 日重庆 3 名学生核酸结果异常 ，其中 1 人已确认阳性，目前当地疫情情况如何？
5600,11 月 14 日广东新增本土确诊 586 例、无症状感染者 5047 例，目前情况如何？
5601,为啥没人向哈尔滨学习防疫?
5602,7 月 14 日日本东京都政府将新冠疫情感染级别调至最严重级别，目前当地都采取了哪些防控措施？
5603,如何评价杭州辟谣“周三封城”“某公司号召员工囤货”?
5604,多地呼吁「非必要不打 120 ，不去医院」，会带来什么影响？有什么信息值得关注？感染新冠后该如何处理？
5605,因2022年3月爆发的疫情你会对上海会产生幻灭吗？
5606,美国疾控中心称约 58% 的美国人曾感染新冠病毒，这一数据说明了什么？
5607,如何看待上海疾控回应「 小区封控已久为何还不断出现阳性」，上海未来疫情防控将如何发展？
5608,甘肃省 12320 官方回应兰州核酸只做 16 元单采，目前当地疫情情况如何？
5609,如何看待郎咸平回应母亲因防疫延误救治去世，称「希望悲剧不要再发生」？
5610,9 月 10 日山东济宁就防疫带来不便深深致歉，目前当地疫情形势如何？
5611,5 月 6 日台湾新增本土新冠确诊病例 36168 例，再现单日最大增幅，目前当地疫情情况如何？
5612,如何看待广州海珠「密接者原则上集中隔离，符合居家隔离条件的居家隔离」？该地目前状况如何？
5613,如何看待被新冠压制近三年后各类呼吸道病毒反弹，美国儿科患者激增，中国会出现类似情况吗？该如何预防？
5614,多个超大特大城市同步调整防疫措施，专家建议优化隔离政策，这释放了什么信号？
5615,如何看待《睡前消息》417期：世界卫生组织“推荐”连花清瘟胶囊说法的由来？
5616,北京此轮疫情 4 名死亡病例均为「新冠轻症」的高龄老人，如何理解专家称「因严重基础性疾病并发症去世」？
5617,如何看待近日唐山站要求出站人员乘坐指定车辆、人车合影、写承诺书这一举措？
5618,长春一女子贩卖非生活必需品「麻辣烫」，并利用志愿者身份送货上门，已被行拘，女子的行为是否合适？
5619,中国商飞CR929副总师孟庆功在沪病逝，生前还志愿参与疫情防控。如何评价孟庆功生前功绩？
5620,媒体称多地推行「阳性居家」，专家释疑「邻居感染风险多大 」，如何从医学角度解读？ 哪些信息值得关注？
5621,怎么看待差点被熟人强奸的事？
5622,保定疫情冲上热搜，如何与新冠病毒相处？目前疫情形势如何？
5623,山东一男子多次拒绝核酸检测被行拘，能起到哪些警示作用？
5624,3 月 31 日，无锡发布通告，「公交地铁停运，非必须不出门」，目前当地情况如何？
5625,我国科学家发现新冠治疗新药，这将对我国疫情防控工作带来哪些帮助？
5626,教育部称「五一」非必要不离校，目前全国各地区疫情情况如何？
5627,为什么西方国家每轮新冠疫情稍有缓解就解除口罩令？
5628,中国医药将负责辉瑞公司新冠治疗药物 Paxlovid○R 在中国大陆的进口和经销，哪些信息值得关注？
5629,如何看待退休主编胡锡进新冠检测阳性？
5630,中疾控前首席专家称「造成疫情来势汹汹原因是多方面的，不能都归结于『放开』」，如何看待这一观点？
5631,8 月 7 日西藏发现 4 名新冠病毒阳性感染者，最后一片「净土」也遭疫情侵袭，目前当地疫情情况如何？
5632,国家卫健委明确提出防控「九不准」，这对疫情防控有何帮助？
5633,如何看待京东新ceo徐雷发的这条朋友圈？
5634,5 月 10 日超强变异新冠毒株登陆韩国，传染性比奥密克戎毒株高 30%，目前当地防控情况如何？
5635,兰州 7 月 19 日开启新一轮大规模核酸筛查，无故不参加一律赋黄码，目前当地防疫措施如何？
5636,梁万年称优化防控不是完全放开，更不是被动放开，「现已接近恢复疫情前生活的时机」，哪些信息值得关注？
5637,如何看待多地宣布「歌可唱、舞可跳，部分只查绿码」？对市民生活会产生什么影响？
5638,吉林四平铁东区 2 人多次未做核酸检测被警方传唤，并要求补缴历次核酸全部费用，如何评价这一做法？
5639,疫情放开之后，另一半的哪些表现让你庆幸找到了「对的人」？
5640,除了新冠病毒，诺如病毒也开始发威了，如何预防?
5641,如何看待华南理工大学国际校区2023年春季学期开学进出校园仍需要外出申请？
5642,湖北黄冈市曾对疫情一问三不知的唐主任有新职，如何看待此事？
5643,广州、无锡销毁涉疫个人数据，如何看待此事？将带来那些影响？
5644,怎样才能成为小阳人？
5645,疫情期间夜不归宿被大学记过处分影响考教师编吗?
5646,为什么电视剧《狂飙》中2021年的场景中没有疫情相关的场景?
5647,2023.1.17后，回国是联程机票的话是否只需要第一段航段登机前48小时阴性就行了？
5648,杭州师范大学仓前校区现在对社会人士开放吗？图书馆和食堂呢？
5649,疫情病毒除了酒精之外有没有其他可以防范的消毒办法？
5650,疫情防控新阶段如何发挥党组织优势助力非公企业走出困境？
5651,疫情期间你做过什么令大白捅嗓子眼的时候省事点的举动？
5652,请问基本结束和完全结束哪个才是结束？
5653,被陌生人故意传染了新冠是什么感觉?
5654,2023年了，还有打卡中断，变红码要写检讨书和发送行程卡的事？知友们怎么看？
5655,疫情结束，大家出外就餐就多了，餐厅提供的消毒餐具干净吗？你担心吗？你有自己再开水烫一下吗？
5656,甲流和新冠的区别是什么？如何做好防护？
5657,用逻辑与思维中提高创新思维能力的知识 谈谈中国抗疫过程中是如何发挥创新思维能力 实现多路探索的?
5658,新开学，学校还需要做些疫情防控措施么？
5659,这个疫情放开后的春天，你对人生的看法有什么变化？
5660,2 月 23 日国务院联防联控机制新闻发布会，将介绍巩固疫情防控重大成果有关情况，哪些信息值得关注？
5661,中疾控通报近日通报，2022 年 12 月以来国内首次检出 XBB.1.5 ，哪些信息值得关注？
5662,2023年春季开学后中小学还有没有必要进行晨午检测温等防疫政策？
5663,现在初中和高中还在实行封闭管理吗？
5664,乙类乙管实施 2 个月江苏航空口岸进出境旅客同比增长超 10 倍，这对运输业复苏有哪些帮助？
5665,山东推出十项措施，优化统筹新阶段疫情防控和稳就业，其中都有哪些好的相关举措？
5666,国务院联防联控机制表示医疗物资保障组全面加强重点医疗物资生产调度，如何看待此事？
5667,日本或 5 月 8 日取消所有新冠病毒相关边境防控措施，目前当地情况如何？
5668,海关总署发布关于防止猴痘疫情传入我国的公告，该疾病具有哪些威胁性？
5669,我国尚未监测到德尔塔克戎变异株，你对该毒株有哪些了解？
5670,专家就如何避免新冠二次感染问题进行了解答，如何看待此事？
5671,2 月 16 日驻加蓬使馆提醒中国公民警惕周边出现马尔堡病毒感染，目前该疾病在当地的传播规模如何？
5672,重庆疾控发布校园防控流感提醒，目前当地流感传播情况如何？
5673,消息人士称 3 月 1 日起日本将放宽自中国入境旅客检疫措施，目前当地情况如何？
5674,国家卫健委称全国疫情日趋平稳，总体向好态势持续巩固，你对此有何看法？
5675,2 月 20 日尼日利亚报告 531 例拉沙热病例，85 人死亡，目前当地防疫情况如何？
5676,中疾控表示 CH.1.1 短期内不会引起本土大规模流行，应采取什么措施进行防护？
5677,国务院联防联控机制将加强部门协同，增强学校疫情防控能力，各校会采取哪些措施？
5678,珠澳口岸通关场所限次通行措施暂定再延长三个月，什么原因导致该措施延长？
5679,如何看待美国奥密克戎日均死亡人数已超过德尔塔日均死亡病例峰值？
5680,塞浦路斯研究人员称发现「德尔塔克戎」毒株，疑似德尔塔和奥密克戎「双毒合一」，会对疫情产生哪些影响？
5681,吃右美沙芬对身体有什么害处？
5682,如何看待中药连花清瘟对德尔塔病毒有效？
5683,专家警告德尔塔毒株「隐秘传播」，可能卷土重来，如何从科学角度分析德尔塔重来的可能性？哪些措施可以预防？
5684,3 月 9 日欧洲出现德尔塔奥密克戎混合毒株，目前情况如何？对新冠疫情防控有何影响？
5685,德国 22 年死亡人数比 21 年多出了 3.4%，造成这一现象的原因是什么？奥密克戎毒性是否被低估？
5686,如何看待当今世界增长速度最快的新冠变种AY.4，有何特点？
5687,得了德尔塔之后，有可能再得拉姆达吗？
5688,台湾出现首例新冠病毒 AY.4.2 亚变异株感染病例，可传播性提高 15%，该病毒还有哪些特点？
5689,8 月 5 日江苏新增本土确诊 61 例，其中扬州 58 例，目前情况如何？有哪些信息值得关注？
5690,南京疫情：禄口机场为何会失守？
5691,德尔塔病毒有什么特点？与 2020 年年初的新冠病毒相比，有多大区别？
5692,美国总统拜登宣布了一个「六步计划」来控制新冠疫情，该如何评价这个计划？美国难以控制住疫情的原因有哪些？
5693,如何看待泰国近期出现德尔塔XAY.2毒株？
5694,郑州一医生确诊，前 7 次检测结果为阴，第 8 次才显阳，德尔塔具有高隐蔽性吗？防范还需要注意什么？
5695,日本研究人员称「新冠拉姆达变异毒株或可逃避中和抗体」，将对疫情产生怎样的影响？
5696,如何评价英国宣布「7月19日基本取消新冠管控措施」，并鼓励民众「与新冠共生」？这对全球抗疫会有何影响？
5697,目前德尔塔已经有一百多种亚型，其中除了AY.4.2以外值得关注的子毒株有哪些？
5698,如何看待杨子峰教授称#新发现中药连花清瘟对德尔塔病毒有效# ?
5699,钟南山等团队精确描绘「德尔塔变异株」完整传播链，系全球首次，这对疫情防治具有哪些意义？
5700,德尔塔变种病毒已扩散至 104 个国家，并出现完整接种疫苗人群感染病例，这给我们哪些警示？
5701,德尔塔病毒为什么这么毒，能从生物角度简单科普一下吗？
5702,得了变异的新冠病毒（德尔塔病毒），身体会什么反应，又是什么症状？
5703,7 月7 日，瑞丽 1 地升为高风险， 7 份阳性样本基因组序列与德尔塔变异株高度同源，目前情况如何？
5704,如何评价美国多州未达到白宫新冠疫苗接种目标，调查显示 30% 美国人明确拒绝接种新冠疫苗？
5705,如何看待美CDC报告接种疫苗后感染Delta病毒载量与未接种者几乎相同？应该怎样应对Delta病毒？
5706,陕西西安此次本土疫情为德尔塔变异毒株引起，存在隐秘性传播，有哪些值得关注的信息？
5707,世卫组织「德尔塔和奥密克戎毒株对全球疫情造成双重威胁」，目前哪些国家疫情最为严重？
5708,2021年8月28日，美国新增死亡超3000例。美国下半年疫情走势如何？对美国国内会有什么影响？
5709,11 月 27 日香港新增 3 例新冠肺炎输入确诊病例，目前当地防疫情况如何？
5710,马来西亚、印尼新冠疫情是不是已经失控了？
5711,莆田新增本土病例「19+17」，15 人为小学生，目前情况如何？
5712,国家卫健委称本轮疫情已波及 11 个省份，感染者大多有跨地区旅游活动，目前疫情防控情况如何？
5713,英国死于 Delta 新冠变种病毒的病例近 1/3 接种过两剂疫苗，说明了什么问题？
5714,有没有专业的知道泰国那边疫情按照现在的管理政策大概多久缓和？
5715,日本疫情神速消退，本月重开国门，还有哪些信息需要关注？
5716,北京昌平某确诊病例密接 1751 人，北京疫情目前情况如何？
5717,福建莆田出现「超长潜伏期」病例，德尔塔毒株出现了新变化吗？哪些手段可以有效检测和控制传播？
5718,国家卫健委7月29日通报全国新冠疫苗接种超16亿剂次。多地接连报告本土病例，疫情防控还应注意哪些问题？
5719,德尔塔克戎的症状是什么。与奥密克戎的区别？
5720,以岭药业新专利可抗击德尔塔毒株，你对该专利有哪些期待？
5721,1 月 19 日泰国检出奥密克戎与德尔塔重组体，感染这两种毒株有哪些表现？该如何治疗？
5722,12 月 11 日起，深圳不再对抵深人员采取疫情核查防控措施，哪些信息值得关注？
5723,深圳和西安疫情防控对比、你怎么看这个问题？
5724,深圳发布疫情防控措施，目前深圳疫情情况如何？
5725,2022年3月20日下午，深圳卫健委等公众号先后发布通告，深圳解封了吗，当地情况怎样，你是如何看待的？
5726,8 月 29 日深圳罗湖全域实行管控措施，目前罗湖疫情形势如何？
5727,深圳也有奥密克戎了，在深圳工作的人还能回家吗？你打算回家过年还是选择留深？
5728,3 月 4 日深圳昨日新增 21 例确诊，涉及超市餐厅，这一波疫情袭击之下，深圳目前情况如何？
5729,3 月 2 日起乘坐深圳地铁须出示 48 小时核酸，目前当地疫情情况如何？
5730,如何看待2022年4月2日深圳市教育局发文宣布返校时间？
5731,深圳出行要48小时核酸，为什么常规采样点少之又少？
5732,深圳一直做核酸有必要吗？
5733,为什么和上海等地比，深圳疫情的新增无症状数少而新增确诊数多？
5734,如何看待3月16日深职院和深信息学生宿舍在学生不知情的情况下被征用为隔离区?
5735,如何看待深圳本次疫情，这个年深圳人能否回家过年？
5736,如何看待无锡的抗疫政策？
5737,4 月 8 日无锡发布通告，进入地铁、超市、商场等公共场所须持 48 小时核酸阴性证明，目前情况如何？
5738,广州教育局表示广州 8 个区全面停课，南沙、从化、增城不停课，目前当地疫情防控情况如何？
5739,广州现在疫情怎么样?
5740,广东疫情为什么会突然爆发？
5741,疫情轮流转，今天到广州。广州会是下一个上海吗？
5742,专家称「学界并未确认新冠肺炎有后遗症」，后遗症在医学上是怎么定义的？
5743,如何看待专家称广州、北京等地疫情高峰可能已经过去？
5744,广州是否存在过度防疫？
5745,4 月 11 日起广州中小学暂停线下教学，体育中考暂停，目前当地疫情情况如何？
5746,关于广州太古汇疫情-如何看待广州白云国际机场董事长辞职？
5747,如何看待世界杯开幕前1小时广州天河区暂停堂食？这一举措将会带来哪些影响？
5748,你好陌生人，你还记得…那些没有疫情的日子里 你是怎么生活的吗？
5749,白云机场声明网传「白云机场董事长辞职与新冠肺炎病例有关」纯属谣言，其中有何信息值得关注？
5750,奥密克戎在大规模的人口里循环返强概率有多大？如果返强怎么应对？
5751,如果突然公司跟你说要降薪，问你什么意见，你如何回答？
5752,疫情封控，没办法上班，公司扣我们工资，合理吗?
5753,如何看待胡锡进评防疫现状，称「已做好一个月内被感染的思想准备，愿意参与承受这份风险」？
5754,如何看待上海一男子提前囤菜，买回50包烟60瓶可乐，一根菜没买，气坏妻子？
5755,上海封控下的物资真实情况到底是什么样的？
5756,如何看待上海一新人结婚当天新郎被封控，为完成婚礼新娘和人形牌完婚？还有哪些办法可以增加现场仪式感？
5757,郑州主城区今天开始封控，一周后能如愿清零吗？
5758,封控楼 要求下楼做核酸 可以拒绝吗？
5759,郑州高校封校期间，一女生操场摆摊修眉生意火爆，顾客大多是男生，为何男生更热衷修眉？
5760,上海一超市员工购买物资加价向封控小区居民销售已被采取刑事措施，这起到了哪些警示作用？
5761,山东济南一名女子小区被封控公司暖心送来电脑让其封控不忘工作，怎样点评女子公司的举动？
5762,男朋友因为工作没办法陪我怎么办？
5763,我们没有物资，如何备战？
5764,封控期间，事业单位单位，公务员是怎么解决吃饭问题的？
5765,疫情永久化常态化会带来多大的影响？疫情对人类文明究竟是发展还是进步？
5766,小区封控期间应该开哪些店？
5767,如何评价丹东父女被拒看病?
5768,警方通报父女黄码看病被拦后袭警，你认为该事件发生的根本原因是什么？
5769,6 月 23 日官方回应父女黄码看病袭警已注意到网络舆情，正在进一步调查，目前该事件调查情况如何？
5770,香港政府放宽入境限制，抵港z疫改0+3，不需入住隔x酒店，如何看待？
5771,90 后女孩因隔离错过毕业申报致法律职业资格申请被拒，因此起诉福州司法局，法律角度如何解读？
5772,唐山一隔离酒店要求吃药拍视频，当地回应称「非强制 ，不吃签承诺书」，如何把握防疫尺度？
5773,官方回应上海金山婴幼儿隔离点照片事件，「非隔离点，系内部腾挪中的场景」，救治婴幼儿患者应注意哪些？
5774,如何看待上海部分封控社区让志愿者或保安帮忙运送可乐、西瓜、榴莲等非生活必需品？这种诉求合理吗？
5775,相关居委针对网传抵京居家监测需戴监测手环一事回应称「 确有此事 」，你对戴监测手环此举有何看法？
5776,如何看待网传一癌症病危留学生在上海因不满隔离医院水平制造舆论，企图让专家和医护人员单独为她隔离治疗？
5777,武汉回应网友建议限制外地人免费隔离，你对武汉该政策有哪些评价？
5778,网传广西灵山县平山中学隔离环境不忍直视，警方通报「内容失真」，如何看待这一事件？
5779,封寝太久情绪好容易崩溃怎么办?
5780,男子去年返乡未隔离致多人感染已撤案，如何从法律角度解读此案件？
5781,台湾疫情的实时报道（台湾如今的疫情如何）？
5782,5 月 10 日台湾新增本土新冠确诊病例 50780 例，死亡 12 例，目前当地疫情防控如何？
5783,“看好了世界，台湾人只示范一次，在两周内解除三级”这句话是谁讲的？
5784,如何看待台当局宣布下周起可「全民免费接种疫苗」？
5785,甘肃本次疫情病毒为变异株 BA.2.38，该毒株具有哪些威胁性？
5786,兰州疫情为什么其他省没有捐赠 ，也没有支援，也没有明星呐喊？
5787,连续三日新增感染者总数超 400 例，广西甘肃无症状感染者增多，各地本轮疫情有何特点？
5788,7 月 17 日甘肃新增本土确诊病例 28 例、本土无症状感染者 183 例，目前当地疫情情况如何？
5789,7 月 14 日甘肃兰州疫情处于上升期，已发生社区传播，当地需采取哪些措施来加强防控？
5790,5 月 9 日河南新增 25 例本土确诊病例和 98 例本土无症状感染者，目前当地疫情形势如何？
5791,进行一次全国的核酸检测，筛查到底有多少城市潜伏着末知病例，可行吗？
5792,当下郑州疫情10号有待解封吗？
5793,疫情下我爸爸开的小公司快没钱发工资了即将要破产了该怎么面对?
5794,1 月 9 日河南新增 60 例本土确诊病例，目前情况如何？
5795,1 月 10 日河南新增 87 例本土病例，其中许昌市 74 例，目前当地的防疫政策如何？
5796,1 月 7 日河南新增本土确诊病例 43 例，郑州 24 例、许昌 18 例、周口 1 例，情况如何？
5797,网传河南一高校急需防疫物资，校方回复称情况属实，如何看待此事件？河南高校防疫具体情况如何？
5798,11 月 11 日河南新增本土确诊 107 例、无症状 2057 例，目前当地疫情情况如何？
5799,1 月 19 日河南安阳文峰区因防疫宣布「宵禁」，后修改为「管控再升级」，会有哪些影响？
5800,河南 1 月 15 日新增本土确诊病例 29 例，其中安阳 15 例，目前情况如何？
5801,5 月 8 日河南新增本土确诊病例 14 例、本土无症状感染者 46 例，目前当地疫情防控如何？
5802,7 月 23 日河南新增本土无症状感染者 17 例，目前当地疫情情况如何？
5803,7 月 15 日河南新增本土「1+39」，涉及驻马店、郑州，目前当地疫情情况如何？
5804,5 月 7 日河南新增本土确诊病例 25 例、本土无症状感染者 76 例，目前当地疫情情况如何？
5805,现在安阳文峰区，备的东西吃完了，该向谁求助？
5806,5 月 20 日河南新增本土确诊病例 1 例，本土无症状感染者 38 例，目前疫情情况如何？
5807,2022年5月16日从平顶山叶县去漯河舞阳会不会变黄码？
