rid,question_name
1845,病毒灵治疗流感3天消症7天治好，阻断RNA病毒转录的，0.2g×100片一瓶3元，为什么现在不使用？
1846,新冠口服药被要求即刻下架，专家称该药绝对不应让全民吃，还有哪些信息值得关注？
1847,可以提前准备哪些应急药物以防新冠重症？
1848,先声药业、君实生物的两款国产新冠口服药获批上市，这两款药品的药效如何？
1849,日本盐野义新冠口服药未获紧急批准，其原因是什么？
1850,美国药管局批准辉瑞新冠口服药的紧急使用授权，这意味着什么？目前美国疫情情况如何？
1851,默沙东公司的新冠口服药获得美国批准用于高风险人群，该款口服药药效如何？
1852,新冠口服药捷报频传，这种药的原理是什么，会改变未来抗疫的趋势吗？
1853,默沙东新冠口服药拟在华生产，正与国药谈判授权，这将产生哪些影响？
1854,我国首个抗新冠肺炎小分子口服药阿兹夫定，获批上市，该药疗效如何？
1855,可口可乐能否缓解新冠症状？
1856,国产首款新冠口服药「阿兹夫定片」正式投产，对于抗击新冠肺炎疫情具有哪些积极意义？还有哪些信息值得关注？
1857,先声药业先诺欣、君实生物民得维，两款国产新冠口服药附条件获批上市，这两款药品的药效如何？
1858,君实生物回应新冠口服药进展，立即投产并尽快发货销售，目前生产进展如何？
1859,辉瑞新冠口服药去年收入 189.33 亿美元，是默沙东的 3 倍，今年均面临腰斩，哪些信息值得关注？
1860,君实生物口服药争取一个月内落地，这能否满足市场需求？
1861,两款新冠口服药，附条件批准上市，这两款药品的药效如何？
1862,我国两款口服抗新冠病毒创新药附条件获批上市，这两款药品的药效如何？
1863,新冠口服药「莫诺拉韦」正式落地广深 3 家医院，会为当地患者带来哪些福音？
1864,君实生物新冠口服药获批后立即投产，你对该药品有哪些期待？
1865,新冠口服药竞争加剧，先声药业先诺欣获特批上市，该药品相比同类产品具备哪些竞争优势？
1866,新获批国产新冠口服药先诺欣，预计 2 周后进入市场，该药品药效如何？
1867,两款国产新冠口服药价格出炉，这两款药品的药效如何？
1868,先声药业回应新冠口服药挂网，预计两周后可购买，该药品的药效如何？
1869,如何评价中疾控中心称我国新冠疫苗接种不良反应发生率为11. 86/10万剂次？还有哪些信息值得关注？
1870,如何看待以色列的研究发现，南非发现的变种病毒能突破疫苗保护网？
1871,深圳康泰生物的新冠疫苗怎么样？
1872,mRNA疫苗和重组蛋白亚单位那个在未来新冠领域更有前途?
1873,我打的一针疫苗，怎么打加强针？
1874,全国多地已启动！接种“加强针”安全吗？效果怎么样？
1875,吃了感冒药第二天可以打第二针新冠疫苗（第一针一个月前就打了）吗？
1876,打完新冠疫苗第一针能喝咖啡吗？
1877,在国外那种新冠疫苗最安全？
1878,日本首次报告接种莫德纳疫苗后死亡，因果关系待确认，你怎么看？
1879,打第三针新冠疫苗的时候和打第二针的共用一瓶药剂，这样是合理的吗？
1880,在全球新冠疫情肆虐的今天，美国囤积了大大超过本国需要的疫苗，到底是出于什么目的？
1881,打完第二针新冠疫苗可以吃雪糕吗？
1882,为什么美国扫货那么多疫苗，普通人却难以打上？
1883,感冒了 还可以打新冠疫苗第二针吗?
1884,等疫苗供应不紧张的时候，我能否把市面上所有的新冠疫苗都打一遍？
1885,打了第一针新冠疫苗超过10周了，还能打第二剂吗？
1886,国内哪里可以接种新冠mrna疫苗？
1887,如何看待多地发布秋季入学新规：开学报到需持家长疫苗接种凭证？
1888,已经阳过一次了，如何防止“二次羊”呢？
1889,第二针疫苗提前几个小时打会有影响吗?
1890,既然新冠疫苗第一针和第二针是一样的，为什么要停止第一针接种，相对来说一针没打的人不是更需要接种吗？
1891,我一月份打了新冠疫苗，为了延长保护期6月份再打新冠疫苗 可以吗？会有什么影响吗?
1892,全球首款吸入式疫苗什么时候才能普及，接种过传统疫苗还用不用使用吸入式疫苗?
1893,打第二针疫苗要去打第一针的地方吗？
1894,中疾控表示应提高老年人群疫苗接种率，尽快实现应接尽接，目前老年人接种率有多少？高龄老人能不能接种？
1895,新冠疫苗在印度已经开始接种了吗？
1896,完成接种新冠疫苗后可以打狂犬疫苗吗？医生病例描述和我所述不一致怎么办？
1897,2021年4月底5月初青岛哪里可以打3针的新冠疫苗？
1898,我已经打完三针新冠疫苗，以后是不是可以横着走了？
1899,天津武清的朋友们：新冠疫苗接种常见问题有哪些？
1900,香港已连续 30 天无本地病例，11 月 11 日起部分市民可接种第三针，目前当地疫苗接种率如何？
1901,福建省到底会不会将康希诺疫苗投入使用？
1902,新冠疫苗打了第一针，超过了三个多月，要重新打还是直接打第二针？
1903,全面放开后，考研人感染风险很大，怎么办？
1904,专家称部分人转阴后出现「白肺」情况，是因为病毒激发了人体免疫反应，如何理解这一现象？出现白肺了怎么办？
1905,怎么在尽量不影响正常生活的前提下，最大程度避免个人感染新冠？
1906,如何看国家卫健委宣布：新冠肺炎更名为新冠感染？
1907,"防感染新冠,用什么样的防护面具,或者DIY改造的优缺点?"
1908,感染了新冠，老咳嗽不是法子呀？该如何缓解？
1909,感染新冠到底怎么样？
1910,病毒学家表示新冠变异可能性将一直存在，但出现更「坏」变异株大流行的概率小，这意味着什么？如何理解？
1911,女子转阴 5 天又阳了高烧 40℃，专家称「属于抗原复阳」，二次感染是什么？和「复阳」有何不同？
1912,大学开学后怎么做能不被感染新冠？
1913,新冠阳康之后，多久才能恢复正常身体机能？
1914,新冠有没有那种一两天就好的人?
1915,感染新冠会出现发热、干咳、乏力、嗅味觉减退、鼻塞、流涕、咽痛、结膜炎、肌痛和腹泻的原因是什么？
1916,得新冠好了还会传染别人吗？
1917,国内疫情到底严重不严重啊？
1918,喉咙很不舒服，吃什么药会比较好？
1919,为什么很多人都都在囤赖西吡氯铵呢？
1920,一个健康的成年男性，在每隔半年就感染一次新冠的情况下，到多少次会死亡？
1921,药店抗原进价 60 卖 200 被罚 20 万 ，已高价售卖 7000 多盒抗原，如何看待此事件？
1922,国家卫生健康委发布公告，将新型冠状病毒肺炎更名为新型冠状病毒感染。传达出那些信息，预示着什么？
1923,四川要求实现「压峰」转段，疾控调查显示感染率已过 63.5 %，哪些信息值得关注？
1924,阳过之后心跳快是得了心肌炎吗？
1925,专家表示「新冠引发的腹泻3天内可自行缓解」，哪些信息值得关注？
1926,新冠感染康复了会带来什么困惑?
1927,得新冠了要和同学说吗？
1928,自驾回家过年在服务区上厕所吃饭会感染新冠的概率大吗？
1929,新冠发烧，咳嗽算是无症状还是轻症？ 为什么现在冒出的羊羊们自己的说法大多都经历了发烧等症状？
1930,新冠感染重症病例诊疗方案试行第四版公布，哪些信息值得关注？
1931,12月份得过新冠的人，在接触小阳人后会感染其他人吗？
1932,哺乳期可以打新冠疫苗吗？为什么前后两版新冠疫苗接种指南有关于哺乳期妇女接种禁忌的变化？依据是什么？
1933,有打完新冠疫苗发烧好几天不退的吗？
1934,新冠疫苗第一针没打，现在都是打第二针和第三针，如何破解补救？
1935,白血病康复可以注射新冠疫苗吗?
1936,请问打了新冠疫苗的知友都有什么反应呢？
1937,我国新冠疫苗接种剂次已达6亿，全国各地疫苗接种「热情高涨」，今天你接种上疫苗了吗?
1938,请问新冠疫苗第一针接种北京生物的，第二针接种北京科兴的，可以吗？
1939,想看看有多少人新冠疫苗是混打的？第一针北京生物，第二针北京科兴?
1940,有公司为了满足新冠疫苗接种指标，花钱找人代打，应该向哪里举报？
1941,北京生物的新冠疫苗间隔多久打第二针效果最好？
1942,打两针的疫苗和打三针的疫苗有什么区别呢？
1943,第一针长春生物，第二针可以打北京科兴的疫苗嘛?
1944,打完新冠疫苗后，你第一顿吃的什么？
1945,想找个未接种新冠疫苗的对象是什么心理？
1946,新冠轻症感染者能否打新冠疫苗？
1947,打了新冠疫苗后剧烈运动会有影响吗？
1948,不懂就问，新冠疫苗第二针还需要预约吗?
1949,没赶上打新冠疫苗，去外地旅游会不会受限制呀?
1950,在北京哪里可以打安徽智飞疫苗？
1951,当你打完疫苗，但是你身边的年轻朋友都不去打疫苗时，你能做什么？
1952,如何看待教育部要求引导师生消除疑虑，「提高师生新冠疫苗接种意愿」？你还没接种疫苗的原因是？
1953,新冠疫苗怎么预约啊?
1954,你接种了新冠疫苗了吗？重庆6月份第一针有地方可以打吗？
1955,香港人身住台湾，现在想来上海或厦门接种新冠疫苗，需要哪些材料和手续？
1956,骑车摔伤20天了伤口结痂了 但是有一个有一点流脓 能接种新冠疫苗吗?
1957,请问打过狂犬疫苗的可以打新冠疫苗吗？之前打狂犬疫苗副作用很大，现在还没缓过来。?
1958,共三针的新冠疫苗在哪里打？―北京?
1959,国药新冠疫苗接种时间间隔？
1960,接种新冠疫苗后30分钟乃至两三天内身体有什么反应？
1961,双相情感障碍（躁郁症）是否属于进行性神经系统疾病，能不能打新冠疫苗？
1962,颞下颌关节紊乱能打新冠疫苗吗？怕面瘫啊？
1963,风湿性心脏病，换了瓣膜，能打新冠疫苗吗？
1964,我该不该打第二针辉瑞疫苗？
1965,重庆新冠疫苗哪里能打啊？打了一针，就一直没通知了?
1966,两针剂的疫苗 接种了第一针 接种完后间隔了195天还没有接种第二针疫苗 现在能直接接种第二针疫苗吗？
1967,阴道炎没有完全好的情况下可以打新冠疫苗么？
1968,接种新冠疫苗之后多久可以打流感疫苗？
1969,西安还有和我一样没打第一针疫苗的朋友们吗？（6.16）6.30号之后会重新一轮的接种吗？
1970,已经打完第二针新冠疫苗了，我担心第一针疫苗没有给我打进去怎么办？有什么办法可以检测出来吗？
1971,接种两针新冠疫苗6天后可以做双眼皮手术吗？
1972,佛山三千方新冠疫苗接种中心 48 小时建成投用，日接种可达一万人次，将为疫情防控带来怎样的助力？
1973,有什么能让我妈别排了？
1974,上午喝酒可以打新冠疫苗吗？
1975,现在没接种新冠疫苗要提供什么证明可以出省啊？
1976,新冠疫苗可以重复注射吗？
1977,新冠疫苗接种了一针安徽的那个，后边两针一直没货，该怎么办？
1978,差三个月满16岁可以接种新冠疫苗吗？
1979,新冠疫苗第一针广州打的，第二针在外地可不可以打?
1980,如何看待新冠流调信息频繁泄露？
1981,新冠疫苗两针相隔几天？
1982,去打新冠疫苗医生用我的身份证能查到用药历史吗?
1983,口罩常态化什么时候结束？
1984,体检前可以打新冠疫苗吗？
1985,全球新冠肺炎日增超73万，美国增超27万，你听到后什么感受？
1986,新冠疫苗加强针六个月是从第一针算吗？我这这边都在传打完第二针六个月以后才能打？
1987,日本疫苗接种人数超过1剂次，总人口1.26人，何时能达到群体免疫？
1988,有没有打了新冠之后出现过敏症状的?
1989,打新冠疫苗却发现自己的身份已经打过了?
1990,单支2人份装的新冠疫苗与现有1人份疫苗有何区别？是否影响疫苗效果？如何平均分配给两人打？针头要换吗?
1991,急，我刚刚在注射第二针疫苗时，发生了意外情况。药液都流到胳膊上，然后她又给我补了一针，有影响吗？
1992,请问一下上海6.17以后可以接种新冠疫苗第一针吗？
1993,突然发现自己得来新冠怎么办？
1994,刚刚打完新冠疫苗第二针，现在去染头发可以吗？以前没有任何过敏物质，第一针打完也没有不良反应?
1995,做的肺结核皮试成阳性，可以打新冠疫苗吗？
1996,海外接种了非国产疫苗，回国之后有没有办法在国内防疫系统登记给绿码加金盾?
1997,成人建档时，归属的接种门诊选错啦，可以到别的医院打吗？
1998,正在服药期间能不能打新冠疫苗？
1999,在成都境内或者成都附近（车程一个半小时以内）哪里有可以15――17岁打疫苗的地方?
2000,有过敏性荨麻疹史还有乳腺结节可以打新冠疫苗吗？
2001,孩子八个月了，哺乳期，请问我可以打新冠疫苗吗？
2002,日本一老人一天内被两次接种新冠疫苗，会有哪些影响？
2003,如果疫苗多打一针会有什么影响?
2004,20年已经接种新冠疫苗 今年可以二次接种新冠疫苗?
2005,学校组织3-11岁孩子接种疫苗，您也会想着减少重症风险，尽早带孩子去接种疫苗吗？
2006,第三针新冠加强疫苗，为什么跟小孩的第一针是一样的？
2007,截至 10 月 29 日我国 3 至 11 岁人群已接种新冠疫苗超 353 万剂次 ，这意味着什么？
2008,意大利经济增长预期再调高，12月儿童开始接种疫苗，有哪些信息值得关注？
2009,联防联控机制权威发布「专家介绍儿童接种新冠疫苗的几方面考虑」，其中有什么值得关注的信息？
2010,阳性后选择居家隔离，该如何做好自我管理？
2011,如何看待张文宏团队称「阳性后 99.5 % 的人不必去医院」？
2012,理论上新冠阳性7天能转阴，那如果感染后一开始无症状，有可能在最后几天才出现发烧等症状吗？
2013,哥嫂不顾我妈的身体状况，执意要求还没痊愈的妈妈去照顾阳了的嫂子和孩子，我该怎么帮助我妈？
2014,阳了后高烧不退正常吗?
2015,领导阳了还继续上班，可不可以报警或者起诉？
2016,春节期间面对疫情高峰，居家管理和备药和平时有什么不同？怎样预防白肺和重症？
2017,阳了的都是多少天转阴的，主要症状是哪些？
2018,家里有一个人阳了要怎么做？
2019,感染新冠后的一周时间内，心率从70逐渐上升到90，又逐渐下降到50左右，是正常情况吗？
2020,如何评价原“普外科曾医生”发视频称自己“什么药都没吃阳了三天就好了”?
2021,考前4天阳了，难道真要准备三战了吗？
2022,已经阳过的人给没阳过的一些忠告？
2023,老公在出差，老婆孩子新冠后要不要请假回家照顾？
2024,如何应对别人说我是传染源的说法?
2025,阳性后有必要和之前去过的地方说吗？比如超市商店?
2026,为了安全起见，“阳”了多久可以去上班？
2027,「阳了」如何缓解症状带来的不适？
2028,你们阳了之后，咳嗽都是怎么治愈的？
2029,新冠病毒怎么影响到全身的？症状还一天一个变？
2030,感觉智商下降了是怎么回事？
2031,过年阳了还会回家吗？
2032,同事都「阳了」，我不去上班该算旷工吗？如果有老板以员工确诊为由开除员工，员工要怎么维权？
2033,请问阳了之后能喝羊汤吗？
2034,四个人，三个阳，两室一厅，怎么睡？
2035,阳了，隔离期间有工资吗？
2036,要排斥家里有阳自己没阳的同事来上班吗？
2037,为什么新冠阳了一个要一个月才能打九价，但是没有要求避免九价之后必须避免新冠阴性?
2038,不幸成为小阳人，结束隔离后的消杀和身体恢复应该怎么做？
2039,听说「阳康」后要更注意保暖，为什么呢？
2040,呼吸科承压「病人遍布全院」，怎样看待中国大多医生一定程度「改行为呼吸科大夫」？如何缓解医资紧张境况？
2041,重症高峰下医院现状「许多公立医院打破科室限制」，其中会遇到哪些困难？医生将面临哪些挑战？
2042,为啥得新冠之后有时候会肺疼？？
2043,是我抵抗力太差了吗，病毒怎么还看不上我？
2044,有一样的吗？得了新冠奥密克戎后，身上针刺一样疼?
2045,继连花清瘟、血氧仪后，多地市民求购静注人免疫球蛋白，它究竟能否预防或者治疗新冠？
2046,CBA赛会封闭酒店内出现阳性病例多队感染！这样发展下去联赛还能打完吗？
2047,如何看待洛阳市公布的新冠肺炎中药防治药方?
2048,新冠多次感染的症状和后遗症有哪些以及有什么有效的治疗方法？
2049,世界卫生组织认可：中医药对治疗新冠肺炎安全有效。我怎么看？?
2050,新冠康复后，最想做什么？
2051,重庆医大科研团队发现 3 个新冠病毒超强抗体，这一发现对治疗新冠有什么重大意义？
2052,你听到别人咳嗽时，有什么想法？
2053,新冠肺炎诊疗方案有哪些？
2054,共存后的新冠入院治疗费用由个人还是医保支付？是否会严格界定新冠治疗费用和基础病治疗费用？
2055,有没有可能一位病人携带新冠病毒但病症状不是因为新冠？
2056,从德尔塔到奥密克戎，新冠病毒持续变异，面对奥密克戎，生活中应如何做好防范？
2057,澳门全面启动「加强针」完成接种满 6 个月者可接种，婴幼儿接种会对身体有什么影响吗？
2058,家人阳了，你如何对待？做哪些准备？
2059,为什么很少听到新冠确诊者的症状、治疗过程、治疗环境，以及治愈后的各种情况？
2060,如何分离纯化血浆中的抗体？
2061,新冠后遗症有多吓人？
2062,京东大药房连花清瘟颗粒预约量暴涨，你认为有必要现在就购买吗？
2063,张文宏称新春是个坎儿，提出易感人群居家监测四项指标「症状、氧饱和度、体温、脉搏」，哪些信息值得关注？
2064,新冠密切接触者，怎么做能够最大程度避免发病？
2065,大学生在宿舍应该如何预防新冠呢?
2066,要给父母买空气消毒机呢，什么品牌的好呢？
2067,面对疫情管控放开，作为孕妇该如何预防感染新冠？
2068,个人与家庭应如何做提前准备以应对未来可能到来的新冠第二轮XBB变异株的感染？
2069,现在身边阳的人越来越多，去牙科诊所安全吗?
2070,有苟阴派吗？分享一下避阳经验？
2071,先亮绿码再吵架，如何看待成都街头现「明码飙架」式新型社交？
2072,个人防护胸扣有人听说过么？说是防疫神器，有效期一个月！！?
2073,谁能帮我分析分析，我老公为什么这么做?
2074,阳康后怎么避免二次感染？
2075,秋冬天喝什么最养生驱寒？
2076,为什么专家分析、辟谣了，黄桃罐头、电解质水仍然被买空？
2077,如何加强老人对疫情的防护？
2078,全球唯一新冠预防药首次进入国内，一次 13300 元，不能用医保，该预防药何时能够入医保？
2079,超级密接为什么没有阳?
2080,10 月 11 日北京新增本土感染「 10+1 」，当地疫情情况如何？
2081,如何评价成都市民在核酸检测点遇到「黑码」，官方回应称「方便检测」？
2082,陕西花香医学检验实验室注册于2022年4月14日，这是否因疫情而生？?
2083,有研究表示，新冠核酸检测阳性检出率最低 39%，阴性误检率最高 35%，如何从技术角度解读这一准确率？
2084,新冠疫情常态化了，还需要做核酸吗？
2085,朋友们，新十条出台，全面放开后你会为防护防疫做哪些事？
2086,如何评价12月14日起山东省医疗单位不再查验患者核酸？
2087,国务院提出常态化核酸检测，绝对不能一刀切，释放了哪些信号？
2088,习惯每天做核酸检测是什么体验？
2089,7 月 11 日山东增 2 例本土确诊、新增本土无症状 54 例，目前当地感染者治疗情况如何？
2090,感染新冠症状消失后多久不具传染性？
2091,如果家里带小孩的大人得了新冠，小孩没有的新冠，那大人应该怎么办？
2092,阳了之后可不可以喝酒？
2093,公司要求奥密克戎感染者正常上班，是合法行为吗？
2094,成为密接心理压力大，怎么缓解?
2095,谁能确认真的假的？
2096,英国允许接种两款中国疫苗者入境免隔离，目前英国国内疫情情况如何？
2097,北京生理科学会专家樊晓寒称「许多『长新冠』患者是自主神经系统受损」，啥是长新冠？遇到这种情况该怎么办？
2098,高度近视害怕得了新冠以后出现一些后遗症?
2099,你们的身体恢复了吗？尤其是阳后或者复阳和疑似阳后后遗症的，感觉身体状态下降了吗？
2100,得了新冠真的会有后遗症吗？
2101,奥密克戎变异株现在到底毒力如何？是否还会像过去一样引起肺炎？能不能认为是像流感一样了？
2102,怎么照顾白肺病人？
2103,阳了之后失去味觉，女朋友不安慰我反而想让我表演吃柠檬是什么心态？
2104,大家羊后有什么后遗症，我老公说他抑郁症了？
2105,新冠肺炎会不会导致先天性脊椎裂患者的病情恶化引发脊椎裂的一些合并症？
2106,新冠肺时期，干细胞对肺纤维化有效果吗？
2107,转阴以后，你的身体还好吗？
2108,您新冠肺炎康复之后身体还是那些不适？
2109,在第二波疫情来临时，孩子开学需要做好哪些防护措施，该怎么保护孩子的身体健康？
2110,抗原检测从无人问津到 「一盒难求」，它能代替核酸检测吗？是否会成为下一个造富风口？
2111,核酸检测与抗原检测有什么区别？自测抗原操作上该注意些什么？
2112,为什么两个不同厂家的抗原检测剂但是结果不同?
2113,大家羊了之后都有哪些典型与非典型症状，持续了多久？
2114,多地鼓励自备抗原检测试剂盒，抗原检测试剂市场规模将达 6000 亿，这一规模透露出了哪些信息？
2115,有什么抗原检测试剂采购渠道？
2116,1239000 人份抗原检测试剂盒已投放遵义市场，哪些地方可以购买？
2117,机场安检时要摘口罩怎么防护？
2118,请说一条别人很少知道的防新冠病毒感染措施?
2119,求问，中央空调，如果阳性在主卧隔离，不开空调，其他房间可以开空调吗？会不会导致病毒在整屋传播？
2120,防护面具和过滤棉哪些品牌比较好?
2121,接种康希诺加强针是一种什么体验？
2122,打了腺病毒疫苗半年后要去打加强针吗？
2123,20余省份开打疫苗加强针！你会去打加强针吗？为什么？
2124,12 月 22 日平安夜前夕，英国日增病例超 10 万，目前当地疫情情况如何？
2125,英国将扩大新冠疫苗加强针接种人群范围，目前英国加强针接种率达到多少？当地疫情情况如何？
2126,第二剂加强针选智飞还是康希诺好？
2127,打完三针智飞疫苗，可以打辉瑞或摩德纳吗？
2128,康希诺二合一疫苗预约不到加强针怎么办？
2129,接种疫苗后仍可能感染新冠，加强针到底有没有用？
2130,狂犬疫苗接种期可以接种新冠疫苗加强针吗？
2131,太原万柏林哪个地方能打北京科兴加强针，急用！谢谢?
2132,生理期第一天，被通知后天打疫苗怎么办 有姐妹经历过吗？
2133,活动性肺结核患者现在可以打新冠疫苗吗?
2134,12 月 21 日美国单日新增病例超 28 万例，拜登敦促接种疫苗、加强针，目前美国疫情情况如何？
2135,美疾控中心称「所有成人都应接种新冠疫苗加强针」，目前美国新冠疫苗加强针接种情况如何？
2136,第一针北京科兴 第二针深圳康泰 加强针是可以随便打吗?
2137,国家卫健委发布「疫苗接种仍是疫情防控关键手段，符合条件尽快加强免疫」，目前国内疫苗接种情况如何？
2138,打完疫苗留观30分钟不是很正常的吗？为啥有的人不愿意等?
2139,现在西安哪个离西安站比较近的医院可以打康希诺加强针？
2140,纽约对打加强针民众奖励 100 美元，如何评价这一举措？
2141,11 月 29 日法国单日入院患者再度破千，目前当地疫情情况如何？
2142,奥密克戎来袭，美国加强针接种速度破纪录，这将对美国疫情防控工作带来哪些帮助？
2143,印度病例一周激增 5 倍，南非敦促加强疫苗接种，目前当地疫苗接种情况如何？
2144,新冠疫苗第一二针打了北京科兴，第三针在老家是安徽智飞，有这种情况的有什么反应吗？
